{
  "schema_version": 1,
  "package_id": "cat-sweetness",
  "batch_id": "2026-10-29-cats-dogs-01",
  "generated_at": "2026-10-29T00:03:12Z",
  "status": "PASS",
  "publish_ready": false,
  "render_status": "NOT_RENDERED",
  "summary": {
    "PASS": 85,
    "WARN": 0,
    "FAIL": 0,
    "SKIP": 1
  },
  "checks": [
    {
      "id": "package.schema",
      "label": "Package schema version",
      "status": "PASS",
      "detail": "schema_version=1"
    },
    {
      "id": "package.id",
      "label": "Package id matches folder and slug format",
      "status": "PASS",
      "detail": "id='cat-sweetness', folder='cat-sweetness'"
    },
    {
      "id": "package.batch",
      "label": "Package belongs to a valid batch id",
      "status": "PASS",
      "detail": "batch_id='2026-10-29-cats-dogs-01'"
    },
    {
      "id": "package.pillar",
      "label": "Content pillar is defined",
      "status": "PASS",
      "detail": "pillar='senses'"
    },
    {
      "id": "package.title",
      "label": "Package title",
      "status": "PASS",
      "detail": "title=\"Why Cats Can't Taste Sweetness\""
    },
    {
      "id": "package.central_question",
      "label": "Package central_question",
      "status": "PASS",
      "detail": "central_question=\"Why can't cats taste sweetness?\""
    },
    {
      "id": "package.central_fact",
      "label": "Package central_fact",
      "status": "PASS",
      "detail": "central_fact='Domestic cats carry an unexpressed Tas1r2 pseudogene, so the two-part sweet-taste receptor cannot form.'"
    },
    {
      "id": "package.takeaway",
      "label": "Package takeaway",
      "status": "PASS",
      "detail": "takeaway=\"A cat's indifference to sweets is receptor biology, not pickiness or a preference for expensive food.\""
    },
    {
      "id": "package.title.length",
      "label": "Working title fits YouTube's title limit",
      "status": "PASS",
      "detail": "30 chars"
    },
    {
      "id": "package.placeholder_text",
      "label": "No placeholder text in editorial fields",
      "status": "PASS",
      "detail": "scanned title, question, fact, and takeaway"
    },
    {
      "id": "package.editorial",
      "label": "Editorial status and human-review gate",
      "status": "PASS",
      "detail": "status='source-checked', human_signoff=False"
    },
    {
      "id": "scenes.count",
      "label": "Scene count is within the channel range",
      "status": "PASS",
      "detail": "6 scenes (allowed 4-8)"
    },
    {
      "id": "hook.duration",
      "label": "Hook lasts 1-3 seconds",
      "status": "PASS",
      "detail": "duration=2.5s"
    },
    {
      "id": "hook.text",
      "label": "Hook is a short, concrete spoken line",
      "status": "PASS",
      "detail": "7 words: \"Your cat can't taste sugar. Here's why.\""
    },
    {
      "id": "hook.first_scene",
      "label": "Hook is the first scene and matches its narration",
      "status": "PASS",
      "detail": "scene s1 must open at 0 and use the hook text/duration"
    },
    {
      "id": "scene.s1.id",
      "label": "Scene s1 has a unique id",
      "status": "PASS",
      "detail": "id='s1'"
    },
    {
      "id": "scene.s1.timing",
      "label": "Scene s1 starts where the previous scene ended",
      "status": "PASS",
      "detail": "start=0, expected=0.0, duration=2.5"
    },
    {
      "id": "scene.s1.narration",
      "label": "Scene s1 has original narration",
      "status": "PASS",
      "detail": "7 words"
    },
    {
      "id": "scene.s1.pace",
      "label": "Scene s1 narration fits its duration",
      "status": "PASS",
      "detail": "2.80 words/s (allowed 1.40-4.40)"
    },
    {
      "id": "scene.s1.visual",
      "label": "Scene s1 has a specific visual instruction",
      "status": "PASS",
      "detail": "description >=40 chars, subject/motion/continuity set, 9:16 framing, >=2 avoid notes"
    },
    {
      "id": "scene.s1.welfare",
      "label": "Scene s1 does not request distress or aggression",
      "status": "PASS",
      "detail": "no banned distress/aggression terms"
    },
    {
      "id": "scene.s2.id",
      "label": "Scene s2 has a unique id",
      "status": "PASS",
      "detail": "id='s2'"
    },
    {
      "id": "scene.s2.timing",
      "label": "Scene s2 starts where the previous scene ended",
      "status": "PASS",
      "detail": "start=2.5, expected=2.5, duration=7.5"
    },
    {
      "id": "scene.s2.narration",
      "label": "Scene s2 has original narration",
      "status": "PASS",
      "detail": "18 words"
    },
    {
      "id": "scene.s2.pace",
      "label": "Scene s2 narration fits its duration",
      "status": "PASS",
      "detail": "2.40 words/s (allowed 1.70-3.30)"
    },
    {
      "id": "scene.s2.visual",
      "label": "Scene s2 has a specific visual instruction",
      "status": "PASS",
      "detail": "description >=40 chars, subject/motion/continuity set, 9:16 framing, >=2 avoid notes"
    },
    {
      "id": "scene.s2.welfare",
      "label": "Scene s2 does not request distress or aggression",
      "status": "PASS",
      "detail": "no banned distress/aggression terms"
    },
    {
      "id": "scene.s3.id",
      "label": "Scene s3 has a unique id",
      "status": "PASS",
      "detail": "id='s3'"
    },
    {
      "id": "scene.s3.timing",
      "label": "Scene s3 starts where the previous scene ended",
      "status": "PASS",
      "detail": "start=10.0, expected=10.0, duration=8.0"
    },
    {
      "id": "scene.s3.narration",
      "label": "Scene s3 has original narration",
      "status": "PASS",
      "detail": "18 words"
    },
    {
      "id": "scene.s3.pace",
      "label": "Scene s3 narration fits its duration",
      "status": "PASS",
      "detail": "2.25 words/s (allowed 1.70-3.30)"
    },
    {
      "id": "scene.s3.visual",
      "label": "Scene s3 has a specific visual instruction",
      "status": "PASS",
      "detail": "description >=40 chars, subject/motion/continuity set, 9:16 framing, >=2 avoid notes"
    },
    {
      "id": "scene.s3.welfare",
      "label": "Scene s3 does not request distress or aggression",
      "status": "PASS",
      "detail": "no banned distress/aggression terms"
    },
    {
      "id": "scene.s4.id",
      "label": "Scene s4 has a unique id",
      "status": "PASS",
      "detail": "id='s4'"
    },
    {
      "id": "scene.s4.timing",
      "label": "Scene s4 starts where the previous scene ended",
      "status": "PASS",
      "detail": "start=18.0, expected=18.0, duration=7.5"
    },
    {
      "id": "scene.s4.narration",
      "label": "Scene s4 has original narration",
      "status": "PASS",
      "detail": "20 words"
    },
    {
      "id": "scene.s4.pace",
      "label": "Scene s4 narration fits its duration",
      "status": "PASS",
      "detail": "2.67 words/s (allowed 1.70-3.30)"
    },
    {
      "id": "scene.s4.visual",
      "label": "Scene s4 has a specific visual instruction",
      "status": "PASS",
      "detail": "description >=40 chars, subject/motion/continuity set, 9:16 framing, >=2 avoid notes"
    },
    {
      "id": "scene.s4.welfare",
      "label": "Scene s4 does not request distress or aggression",
      "status": "PASS",
      "detail": "no banned distress/aggression terms"
    },
    {
      "id": "scene.s5.id",
      "label": "Scene s5 has a unique id",
      "status": "PASS",
      "detail": "id='s5'"
    },
    {
      "id": "scene.s5.timing",
      "label": "Scene s5 starts where the previous scene ended",
      "status": "PASS",
      "detail": "start=25.5, expected=25.5, duration=9.0"
    },
    {
      "id": "scene.s5.narration",
      "label": "Scene s5 has original narration",
      "status": "PASS",
      "detail": "23 words"
    },
    {
      "id": "scene.s5.pace",
      "label": "Scene s5 narration fits its duration",
      "status": "PASS",
      "detail": "2.56 words/s (allowed 1.70-3.30)"
    },
    {
      "id": "scene.s5.visual",
      "label": "Scene s5 has a specific visual instruction",
      "status": "PASS",
      "detail": "description >=40 chars, subject/motion/continuity set, 9:16 framing, >=2 avoid notes"
    },
    {
      "id": "scene.s5.welfare",
      "label": "Scene s5 does not request distress or aggression",
      "status": "PASS",
      "detail": "no banned distress/aggression terms"
    },
    {
      "id": "scene.s6.id",
      "label": "Scene s6 has a unique id",
      "status": "PASS",
      "detail": "id='s6'"
    },
    {
      "id": "scene.s6.timing",
      "label": "Scene s6 starts where the previous scene ended",
      "status": "PASS",
      "detail": "start=34.5, expected=34.5, duration=10.5"
    },
    {
      "id": "scene.s6.narration",
      "label": "Scene s6 has original narration",
      "status": "PASS",
      "detail": "30 words"
    },
    {
      "id": "scene.s6.pace",
      "label": "Scene s6 narration fits its duration",
      "status": "PASS",
      "detail": "2.86 words/s (allowed 1.70-3.30)"
    },
    {
      "id": "scene.s6.visual",
      "label": "Scene s6 has a specific visual instruction",
      "status": "PASS",
      "detail": "description >=40 chars, subject/motion/continuity set, 9:16 framing, >=2 avoid notes"
    },
    {
      "id": "scene.s6.welfare",
      "label": "Scene s6 does not request distress or aggression",
      "status": "PASS",
      "detail": "no banned distress/aggression terms"
    },
    {
      "id": "scenes.unique_narration",
      "label": "Scenes do not repeat the same narration",
      "status": "PASS",
      "detail": "6 scene narrations"
    },
    {
      "id": "timing.total",
      "label": "Scene durations sum to the target duration",
      "status": "PASS",
      "detail": "sum=45.0s, target=45s"
    },
    {
      "id": "timing.channel",
      "label": "Target duration is inside the channel range",
      "status": "PASS",
      "detail": "target=45s (allowed 30-60)"
    },
    {
      "id": "narration.medical_claims",